{
  "schemaVersion": 2,
  "engineVersion": "0.1.0-g1",
  "project": {
    "id": "550e8400-e29b-41d4-a716-446655440000",
    "name": "Full Empty V2",
    "createdAt": "2026-09-11T00:00:00.000Z",
    "modifiedAt": "2026-09-11T00:00:00.000Z",
    "author": "Tester",
    "notes": "All collections empty"
  },
  "venue": {
    "id": "660e8400-e29b-41d4-a716-446655440000",
    "name": "Untitled Venue",
    "dimensions": {
      "widthM": 12.0,
      "depthM": 10.0,
      "heightM": 4.0
    }
  },
  "scene": {
    "id": "770e8400-e29b-41d4-a716-446655440000",
    "name": "Default Scene",
    "venueRef": "660e8400-e29b-41d4-a716-446655440000",
    "geometry": {
      "center": {
        "x": 6.0,
        "y": 5.0,
        "z": 2.0
      },
      "listening": {
        "x": 6.0,
        "y": 5.0,
        "z": 2.0
      }
    }
  },
  "audienceReceivers": [],
  "equipment": [],
  "signalGraph": {
    "nodes": [],
    "edges": []
  },
  "powerGraph": {
    "nodes": [],
    "edges": []
  },
  "audioAssets": [],
  "dspPresets": [],
  "arrayConfigurations": [],
  "measurements": [],
  "simulationRuns": [],
  "trainingScenarios": [],
  "inventoryRefs": [],
  "reports": [],
  "auditLog": [
    {
      "ts": "2026-09-11T00:00:00.000Z",
      "actor": "system",
      "action": "project.create",
      "objectId": "550e8400-e29b-41d4-a716-446655440000",
      "detail": "schemaVersion 2"
    }
  ]
}
