{
  "schemaVersion": 2,
  "engineVersion": "0.1.0-g1",
  "project": {
    "id": "550e8400-e29b-41d4-a716-446655440000",
    "name": "SignalGraph Test",
    "createdAt": "2026-09-11T00:00:00.000Z",
    "modifiedAt": "2026-09-11T00:00:00.000Z",
    "author": "Tester",
    "notes": "Minimal valid signalGraph"
  },
  "venue": {
    "id": "660e8400-e29b-41d4-a716-446655440000",
    "name": "Test Venue",
    "dimensions": {
      "widthM": 12.0,
      "depthM": 10.0,
      "heightM": 4.0
    }
  },
  "scene": {
    "id": "770e8400-e29b-41d4-a716-446655440000",
    "name": "Default Scene",
    "venueRef": "660e8400-e29b-41d4-a716-446655440000",
    "geometry": {
      "center": { "x": 6.0, "y": 5.0, "z": 2.0 },
      "listening": { "x": 6.0, "y": 5.0, "z": 2.0 }
    }
  },
  "audienceReceivers": [],
  "equipment": [],
  "signalGraph": {
    "nodes": [
      {
        "kind": "source",
        "id": "a10e8400-e29b-41d4-a716-446655440001",
        "label": "Input Source",
        "position": { "x": 0.0, "y": 0.0 },
        "mixer": { "mute": false, "solo": false }
      },
      {
        "kind": "processor",
        "id": "a10e8400-e29b-41d4-a716-446655440002",
        "label": "EQ Processor",
        "position": { "x": 100.0, "y": 50.0 },
        "mixer": { "mute": false, "solo": true }
      },
      {
        "kind": "output",
        "id": "a10e8400-e29b-41d4-a716-446655440003",
        "label": "Main Output",
        "position": { "x": 200.0, "y": 100.0 },
        "mixer": { "mute": true, "solo": false }
      }
    ],
    "edges": [
      {
        "from": "a10e8400-e29b-41d4-a716-446655440001",
        "to": "a10e8400-e29b-41d4-a716-446655440002",
        "label": "Signal Path 1"
      },
      {
        "from": "a10e8400-e29b-41d4-a716-446655440002",
        "to": "a10e8400-e29b-41d4-a716-446655440003",
        "label": "Signal Path 2"
      }
    ]
  },
  "powerGraph": {
    "nodes": [],
    "edges": []
  },
  "audioAssets": [],
  "dspPresets": [],
  "arrayConfigurations": [],
  "measurements": [],
  "simulationRuns": [],
  "trainingScenarios": [],
  "inventoryRefs": [],
  "reports": [],
  "auditLog": [
    {
      "ts": "2026-09-11T00:00:00.000Z",
      "actor": "system",
      "action": "project.create",
      "objectId": "550e8400-e29b-41d4-a716-446655440000",
      "detail": "schemaVersion 2"
    }
  ]
}
